{"$id":"https://harness.planeon.ai/schemas/v1alpha1/runtime/runtime-trust-bundle.schema.json","$schema":"https://json-schema.org/draft/2020-12/schema","additionalProperties":false,"properties":{"apiVersion":{"$ref":"common.schema.json#/$defs/apiVersion"},"kind":{"const":"RuntimeTrustBundle"},"metadata":{"$ref":"common.schema.json#/$defs/metadata"},"payload":{"additionalProperties":false,"properties":{"bundleVersion":{"maximum":2147483647,"minimum":1,"type":"integer"},"issuedAt":{"$ref":"common.schema.json#/$defs/timestamp"},"keys":{"items":{"additionalProperties":false,"allOf":[{"else":{"properties":{"revocationReason":{"type":"null"},"revokedAt":{"type":"null"}}},"if":{"properties":{"state":{"const":"REVOKED"}},"required":["state"]},"then":{"properties":{"revocationReason":{"enum":["KEY_COMPROMISE","AUTHORITY_WITHDRAWN","SUPERSEDED","POLICY_VIOLATION"]},"revokedAt":{"$ref":"common.schema.json#/$defs/timestamp"}}}}],"properties":{"algorithm":{"const":"ED25519"},"keyId":{"$ref":"common.schema.json#/$defs/stableId"},"notAfter":{"$ref":"common.schema.json#/$defs/timestamp"},"notBefore":{"$ref":"common.schema.json#/$defs/timestamp"},"publicKey":{"$ref":"common.schema.json#/$defs/base64urlPublicKey"},"purposes":{"items":{"$ref":"common.schema.json#/$defs/keyPurpose"},"minItems":1,"type":"array","uniqueItems":true},"revocationReason":{"oneOf":[{"type":"null"},{"enum":["KEY_COMPROMISE","AUTHORITY_WITHDRAWN","SUPERSEDED","POLICY_VIOLATION"]}]},"revokedAt":{"oneOf":[{"type":"null"},{"$ref":"common.schema.json#/$defs/timestamp"}]},"state":{"enum":["PENDING","ACTIVE","RETIRED","REVOKED"]}},"required":["keyId","algorithm","publicKey","purposes","state","notBefore","notAfter","revokedAt","revocationReason"],"type":"object"},"maxItems":128,"minItems":1,"type":"array"},"organizationId":{"$ref":"common.schema.json#/$defs/stableId"},"previousBundleDigest":{"oneOf":[{"type":"null"},{"$ref":"common.schema.json#/$defs/sha256"}]},"validFrom":{"$ref":"common.schema.json#/$defs/timestamp"},"validUntil":{"$ref":"common.schema.json#/$defs/timestamp"}},"required":["organizationId","bundleVersion","issuedAt","validFrom","validUntil","previousBundleDigest","keys"],"type":"object"},"signature":{"allOf":[{"$ref":"common.schema.json#/$defs/signature"},{"properties":{"purpose":{"const":"TRUST_BUNDLE"}}}]}},"required":["apiVersion","kind","metadata","payload","signature"],"title":"RuntimeTrustBundle","type":"object"}
