{"apiVersion":"harness.planeon.ai/v1alpha1","kind":"RuntimeTrustBundle","metadata":{"id":"runtime.trust-bundle-001","version":"1.0.0"},"payload":{"bundleVersion":1,"issuedAt":"2030-01-01T00:00:00Z","keys":[{"algorithm":"ED25519","keyId":"test.ed25519-01","notAfter":"2031-01-01T00:00:00Z","notBefore":"2030-01-01T00:00:00Z","publicKey":"11qYAYKxCrfVS_7TyWQHOg7hcvPapiMlrwIaaPcHURo","purposes":["RUNTIME_ADMISSION","RUNTIME_RECEIPT","TRUST_BUNDLE"],"revocationReason":null,"revokedAt":null,"state":"ACTIVE"}],"organizationId":"acme.example","previousBundleDigest":null,"validFrom":"2030-01-01T00:00:00Z","validUntil":"2031-01-01T00:00:00Z"},"signature":{"algorithm":"ED25519","keyId":"test.ed25519-01","profile":"RFC8785_JCS_ED25519_V1","purpose":"TRUST_BUNDLE","signedMessageDigest":"sha256:14c432c42f19dc9fc26fa5430c229acd15b27450647ebfc3510f7cdeb52754d5","value":"IRrPtsAoTUIm4tiKHlOWm04UDTuH8kd4AM-lXqHBsGBydlxb7QDD6Wd92YSqg7W7cgcFP3HwZEk5BF1zEM5nAg"}}
